<?xml version="1.0" encoding="UTF-8"?>
<!-- edited with XMLSpy v2014 rel. 2 sp1 (x64) (http://www.altova.com) by Lloyd McKenzie (private) -->
<xs:schema xmlns:xs="http://www.w3.org/2001/XMLSchema">
  <xs:element name="workgroups">
    <xs:complexType>
      <xs:sequence>
        <xs:element name="workgroup" maxOccurs="unbounded">
          <xs:complexType>
            <xs:attribute name="key" use="required">
              <xs:simpleType>
                <xs:restriction base="xs:NMTOKEN">
                  <xs:pattern value="[a-z\-]+"/>
                </xs:restriction>
              </xs:simpleType>
            </xs:attribute>
            <xs:attribute name="name" use="required">
              <xs:simpleType>
                <xs:restriction base="xs:string">
                  <xs:pattern value="[A-Z][^\s]*([\s]+[^\s]+)*"/>
                </xs:restriction>
              </xs:simpleType>
            </xs:attribute>
            <xs:attribute name="deprecated" type="xs:boolean" default="false"/>
          </xs:complexType>
        </xs:element>
      </xs:sequence>
    </xs:complexType>
  </xs:element>
</xs:schema>
